<?xml version="1.0" encoding="UTF-8"?>
<!DOCTYPE cv SYSTEM "template.dtd">
<cv>
    <etatCivil>
        <nom>Rines</nom>
        <prenom>Léna</prenom>
        <age>1991</age>
    </etatCivil>
    <diplomes>
        <diplome>
            <libelle>Docteur en médecine</libelle>
            <annee>2005</annee>
            <institution>Université Aix-Marseille</institution>
        </diplome>
    </diplomes>
    <experiences>
        <experience>
            <debut>2020</debut>
            <fin>présent</fin>
            <entreprise>Omnes Santé</entreprise>
            <poste>Médecin-Généraliste</poste>
        </experience>
    </experiences>
</cv>