<?xml version="1.0" encoding="UTF-8"?>
<!DOCTYPE cv SYSTEM "template.dtd">
<cv>
    <etatCivil>
        <nom>Lavaithonku</nom>
        <prenom>Eva</prenom>
        <age>1989</age>
    </etatCivil>
    <diplomes>
        <diplome>
            <libelle>Docteur en médecine</libelle>
            <annee>2001</annee>
            <institution>Université Toulouse 3</institution>
        </diplome>
    </diplomes>
    <experiences>
        <experience>
            <debut>2018</debut>
            <fin>présent</fin>
            <entreprise>Omnes Santé</entreprise>
            <poste>Médecin-Généraliste</poste>
        </experience>
    </experiences>
</cv>